story_id,story_name,synopsis,length,rating,n_votes,total_readers,author_id,author,added_on,codes,slavery,nc,gay,link
843.0,"Thunder, Ben and Eddy",Office bitch rebuffes Junior V.P. Eddy. Eddy elists the aid of his brother to transform office bitch to bitch pet.,32034.0,9.0,4.0,43986,339,BZ,"Mar 29, 2002","['M+/f', 'modification', 'D/s', 'BDSM', 'slavery', 'bondage', 'job', 'mc', 'humiliation', 'nc', 'Serious']",1.0,1.0,False,https://www.bdsmlibrary.com/stories/story.php?storyid=843.0
521.0,Parker 08 Squealer,She was raped and left in a black neighborhood. She became a white whore for black people and a squealer.,61470.0,9.0,8.0,51490,251,Parker,"Oct 6, 2001","['M+/f', 'interracial', 'nc', 'Hardcore']",0.0,1.0,False,https://www.bdsmlibrary.com/stories/story.php?storyid=521.0
517.0,Parker 05 Doctor's Orders,A psychiatrist disguised as a dentist took the advantage of innocent patients and hold them as her slaves.,46666.0,9.0,4.0,48001,251,Parker,"Sep 30, 2001","['F/f', 'incest', 'BDSM', 'slavery', 'mc', 'torture', 'Serious']",1.0,0.0,False,https://www.bdsmlibrary.com/stories/story.php?storyid=517.0
483.0,The Mortgage,"The Mortgage is a ten part story about how an older man manipulates a young newlywed wife into becoming first his secretary and eventually his personal sexual plaything, both on and off-the-job.",111232.0,9.0,6.0,95400,246,Marlissa,"Sep 1, 2001","['M/f', 'F/f', 'bondage', 'slow', 'nc', 'Light']",0.0,1.0,False,https://www.bdsmlibrary.com/stories/story.php?storyid=483.0
239.0,Exploding Cupcakes,Catherine buys an exploding cupcake on credit.She should have paid cash.,171824.0,9.0,13.0,33052,148,Harold,"Mar 28, 2001","['M+/f', 'snuff', 'BDSM', 'nc', 'Extreme']",0.0,1.0,False,https://www.bdsmlibrary.com/stories/story.php?storyid=239.0
19.0,Lynne,"A very long slave training story, but it is also one of the best. After reading all 36 chapters, I still hope there are more :-D",1328585.0,9.0,44.0,359908,16,Just Another Bloke,"Jun 30, 2000","['M/f', 'F/f', 'B/D', 'S/M', 'slavery', 'bondage', 'humiliation', 'Serious']",1.0,0.0,False,https://www.bdsmlibrary.com/stories/story.php?storyid=19.0
29.0,Catwoman's Prey,"Batgirl sets out to solve the mystery of Supergirl's disappearnce, only to join the latter and fall into the hands of Catwoman. Like Supergirl, she is tortured, abused and trained to become a sex slave. And in her new life as a sex slave, Barbara Gordon will get to see the dark side of Gotham city's high society.",136926.0,9.0,6.0,65349,25,Citizen Bane,"Jul 13, 2000","['M+/f', 'F/f', 'B/D', 'nc', 'Serious']",0.0,1.0,False,https://www.bdsmlibrary.com/stories/story.php?storyid=29.0
32.0,Second Place,Two girls competed with each other for almost everything. Finally the second-place fought back and turned the first-place a docile slave.,331239.0,9.0,25.0,137153,26,Terri Madison,"Jul 14, 2000","['F/f', 'humiliation', 'nc', 'Serious']",0.0,1.0,False,https://www.bdsmlibrary.com/stories/story.php?storyid=32.0
77.0,The Trophy Wife,Unfaithful wife and her boyfriend planned to kill her rich husband. Their conspiracy was found out and she was captured and kept as a slave girl. Unfaithful wife got what she deserved.,725119.0,9.0,9.0,110906,55,Special Kwa,"Aug 14, 2000","['M/f', 'M/f+', 'D/s', 'S/M', 'nc', 'Serious']",0.0,1.0,False,https://www.bdsmlibrary.com/stories/story.php?storyid=77.0
94.0,The Slave Trading Club,A young slave girl's training is now sufficient to accommodate her Master's inclusion in an exclusive trading club.,12872.0,9.0,4.0,32929,64,mia slave,"Sep 6, 2000","['M/f', 'BDSM', 'slavery', 'torture', 'Serious']",1.0,0.0,False,https://www.bdsmlibrary.com/stories/story.php?storyid=94.0
110.0,The Humiliation of Jane,"In order to teach this little arrogant girl a lesson, the magic gas was used on her so that she would obey every orders from anyone.",232070.0,9.0,13.0,93425,76,Various Authors,"Sep 21, 2000","['M+/f', 'mc', 'humiliation', 'nc', 'Hardcore']",0.0,1.0,False,https://www.bdsmlibrary.com/stories/story.php?storyid=110.0
122.0,Hired Help,She was hired as a maid for her master and paid very high salary. Later she found out that her tasks were not just housekeeping.,558345.0,9.0,13.0,140730,82,Dark One,"Oct 6, 2000","['M/f', 'D/s', 'slavery', 'Light']",1.0,0.0,False,https://www.bdsmlibrary.com/stories/story.php?storyid=122.0
141.0,The tent of the Bedouin,"Captured, bound and compelled to submit against her will, miel finds her feelings confused when faced with the seemingly merciless Bedouin.",208429.0,9.0,57.0,146215,90,Bedouin,"Nov 6, 2000","['M/f', 'B/D', 'S/M', 'BDSM', 'slavery', 'bondage', 'Serious']",1.0,0.0,False,https://www.bdsmlibrary.com/stories/story.php?storyid=141.0
146.0,Revenge or The Price of Arrogance,An arrogant married couple finally make the mistakes necessary for their downfall. The story is of their ruin.,81792.0,9.0,10.0,51960,92,blairbrek,"Nov 15, 2000","['M+/f', 'exhibition', 'slavery', 'humiliation', 'blackmail', 'nc', 'Light', 'Hardcore']",1.0,1.0,False,https://www.bdsmlibrary.com/stories/story.php?storyid=146.0
213.0,Omens - A Halloween Tale,Five young women crash an exclusive and eletist Halloween party and get caught. The hostess has some strange ways of making the gold digging five pay for their mistake. Now they get more than they expected from the deal.,196520.0,9.0,7.0,51930,136,Musker,"Mar 6, 2001","['F/f+', 'D/s', 'B/D', 'nc', 'Heavy']",0.0,1.0,False,https://www.bdsmlibrary.com/stories/story.php?storyid=213.0
221.0,Cornucopia,"Update of the Omen story dealing with Charlene and Karol, Sue-Lee and Maria, Jennifer.",119065.0,9.0,3.0,40517,136,Musker,"Mar 13, 2001","['M/f+', 'F+/f', 'modification', 'D/s', 'B/D', 'slavery', 'nc', 'Heavy']",1.0,1.0,False,https://www.bdsmlibrary.com/stories/story.php?storyid=221.0
230.0,Renaissance Fair,Follow-up to Dangerous Wagers when Erin finds out Blair wrote a story about her.,27694.0,9.0,4.0,34093,92,blairbrek,"Mar 18, 2001","['F/f', 'bondage', 'humiliation', 'nc', 'Serious']",0.0,1.0,False,https://www.bdsmlibrary.com/stories/story.php?storyid=230.0
243.0,Doc's Orders,His friend offered to train a slave girl for him. He caught these Hitchhikers and sent them over for the training.,278502.0,9.0,10.0,62369,20,Quin,"Apr 2, 2001","['M/f', 'F/f', 'BDSM', 'slavery', 'slow', 'Serious']",1.0,0.0,False,https://www.bdsmlibrary.com/stories/story.php?storyid=243.0
471.0,A Slave To Politics,A Deputy Mayor finds she becomes a sex toy to a sexy young intern.,252147.0,9.0,39.0,264690,239,SpeechMasterOne,"Aug 25, 2001","['F/f', 'bondage', 'humiliation', 'blackmail', 'nc', 'Light']",0.0,1.0,False,https://www.bdsmlibrary.com/stories/story.php?storyid=471.0
259.0,Dawn's Tale,"Nordic-type aliens come to Earth and gently abduct Dawn, who begins a new life as a slave/pet/toy/servant/working animal.",284432.0,9.0,7.0,67667,158,scifitales,"Apr 14, 2001","['M/f', 'M+/f', 'F/f', 'F+/f', 'exhibition', 'lactation', 'modification', 'pregnant', 'WaterSport', 'D/s', 'B/D', 'slavery', 'ScFi', 'reluctant', 'Serious']",1.0,0.0,False,https://www.bdsmlibrary.com/stories/story.php?storyid=259.0
285.0,Pavlov's Bitch,A young student volunteers for a psychological experiment which turns out as a devilish conditioning procedure with no way to escape.,67722.0,9.0,9.0,70258,166,The Fissure King,"Apr 24, 2001","['f-self', 'S/M', 'bondage', 'mc', 'nc', 'Serious']",0.0,1.0,False,https://www.bdsmlibrary.com/stories/story.php?storyid=285.0
295.0,Renee's Loan,"A female student runs out of money and takes a loan to cover her tuition fees. Unfortunately, she forgets to repay, so the contractual collateral is called in: her own body!",79228.0,9.0,4.0,44971,175,Golffdude,"May 3, 2001","['M+/f', 'exhibition', 'modification', 'spanking', 'BDSM', 'slavery', 'college', 'Serious']",1.0,0.0,False,https://www.bdsmlibrary.com/stories/story.php?storyid=295.0
296.0,Cold,Jessica and Jennifer's car breaks down on an extremely cold night. They accept a ride with two men who tell them to 'put out or get out'.,29041.0,9.0,5.0,28683,26,Terri Madison,"May 7, 2001","['M+/f+', 'torture', 'nc', 'Serious']",0.0,1.0,False,https://www.bdsmlibrary.com/stories/story.php?storyid=296.0
327.0,The Taking of Heather,A woman home alone is terrorized then attacked by an intruder.,27547.0,9.0,3.0,21192,177,Heather,"May 13, 2001","['M/f', 'bondage', 'nc', 'Hardcore']",0.0,1.0,False,https://www.bdsmlibrary.com/stories/story.php?storyid=327.0
358.0,Slave girl,All the history of slavery made her horny and wonder what it would feel to be a slave girl. Now she got a chance to be one.,53684.0,9.0,7.0,49544,5,Allene Blake,"May 29, 2001","['M/f', 'D/s', 'S/M', 'slavery', 'Serious']",1.0,0.0,False,https://www.bdsmlibrary.com/stories/story.php?storyid=358.0
376.0,Susan's New Life South of the Border,"A wrong turn on the trip from Mexico City to U.S. Border lead the family to a place called ""La Casa Putas"" - ""House of Whores"". Would they ever be able to go back U.S.?",37960.0,9.0,5.0,42436,194,Headhunter,"Jun 11, 2001","['M/f', 'nc', 'Hardcore']",0.0,1.0,False,https://www.bdsmlibrary.com/stories/story.php?storyid=376.0
381.0,Trick or Treat,"The Halloween Special edition of the ""Doc's Orders"", a story about abduction and slave training.",123048.0,9.0,7.0,41037,20,Quin,"Jun 13, 2001","['M/f+', 'M+/f', 'B/D', 'nc', 'Serious']",0.0,1.0,False,https://www.bdsmlibrary.com/stories/story.php?storyid=381.0
383.0,A Slave Story,A young lady is captured and trained to be a slave by her loving master.,43213.0,9.0,6.0,66467,207,Snyder,"Jun 16, 2001","['M/f', 'spanking', 'BDSM', 'slavery', 'real', 'nc', 'Serious']",1.0,1.0,False,https://www.bdsmlibrary.com/stories/story.php?storyid=383.0
391.0,Callie,Another teen blackmail story. More pain and humiliation as the heroine falls deeper and deeper into the grips of her blackmailers.,146734.0,9.0,7.0,135092,31,Road Runner,"Jun 24, 2001","['M/f', 'teen', 'bondage', 'blackmail', 'nc', 'Serious']",0.0,1.0,False,https://www.bdsmlibrary.com/stories/story.php?storyid=391.0
422.0,Strange Love,"Some pervert catches his 15 year old daughter misbehaving. In a fit of horney abandon, he decides to spank her, and her friend who he caught with her, in the nude. He continues to torment them until over the weeks, there has developed a torrid bdsm threesome between the horney dad, his tortureslut daughter, and her 16 year old lesbian lover.",95978.0,9.0,5.0,60601,215,Mr. Mumei,"Jul 9, 2001","['M/f+', 'F/f', 'MF/f', 'exhibition', 'incest', 'spanking', 'teen', 'BDSM', 'slavery', 'bondage', 'HighSchool', 'reluctant', 'humiliation', 'blackmail', 'torture', 'nc', 'Heavy']",1.0,1.0,False,https://www.bdsmlibrary.com/stories/story.php?storyid=422.0
459.0,Victoria's Secrets,"Dr. Victoria Denning is a consulting psychiatrist for the CA parole board. She uses her position to obtain a torturer and victims for experiments at her secluded ranch. Then she gives herself over for a vacation ""massage"" at the ranch, and gets a little more than she bargained for.",84645.0,9.0,10.0,71629,30,Unknown,"Aug 13, 2001","['M/f+', 'bestiality', 'scatology', 'job', 'consensual', 'torture', 'nc', 'Heavy']",0.0,1.0,False,https://www.bdsmlibrary.com/stories/story.php?storyid=459.0
845.0,Innocence Betrayed - A Thanatos Society Tale,"Being a description of the defilement and humiliation of an innocent fourteen year-old virgin by her parents.  This story is intended as an example of the workings of an aberrant mind.  If you cannot tell the difference between fantasy and reality, read no further.",371687.0,9.0,9.0,198174,390,Cerberus,"Mar 29, 2002","['MF/f', 'incest', 'teen', 'toys', 'WaterSport', 'BDSM', 'torture', 'nc', 'Heavy']",0.0,1.0,False,https://www.bdsmlibrary.com/stories/story.php?storyid=845.0
846.0,Love by the Numbers,"A blonde slave is pierced, infibulated with rings and brutally disciplined by her black Master.",43542.0,9.0,4.0,53265,172,Ladyvet,"Mar 29, 2002","['M/f', 'interracial', 'modification', 'D/s', 'slavery', 'bondage', 'real', 'consensual', 'torture', 'Heavy', 'violent']",1.0,0.0,False,https://www.bdsmlibrary.com/stories/story.php?storyid=846.0
851.0,Parker 21: Teacher's Ransom,A school teacher is inadvertantly caught up in a kidnapping scheme directed at one of her students and falls prey to the kidnappers.,122393.0,9.0,4.0,51883,251,Parker,"Apr 1, 2002","['M/f', 'F/f', 'slavery', 'nc', 'Serious']",1.0,1.0,False,https://www.bdsmlibrary.com/stories/story.php?storyid=851.0
1499.0,Frontier Justice,"Sentenced to die for the murder of her husband, a young woman suffers at the hands of a hungry mob.",36814.0,9.0,5.0,45483,333,Kallie Thomas,"Feb 25, 2003","['M+/f', 'lactation', 'historical', 'humiliation', 'torture', 'nc', 'Heavy', 'violent']",0.0,1.0,False,https://www.bdsmlibrary.com/stories/story.php?storyid=1499.0
1343.0,Janice's Fantasies,"A young female executive lives a personal life of bdsm fantasy. Her imaginary Master makes her go too far, and real people are there to take advantage of her.",37522.0,9.0,8.0,56652,301,J.,"Nov 26, 2002","['M/f', 'bestiality', 'exhibition', 'spanking', 'toys', 'voyeurism', 'S/M', 'slavery', 'real', 'consensual', 'Serious']",1.0,0.0,False,https://www.bdsmlibrary.com/stories/story.php?storyid=1343.0
1359.0,A New Life For Tracy,"A new Life for Tracy is my attempt at a b&d story written from the viewpoint of the dom instead of the sub. It is set in the future when different cultures have rise on different worlds. In it the main character, Tracy, is moved to a new home on a new world after the deaths of her parents, where she finds the use of brutal discipline and slavery is an accepted part of daily life. She finds herself living with two aunts, one of which is a judge who thinks it is OK to sentence people to slavery for crimes committed while the other is a governor of a female prison where Tracy gains her first experience with this brutality. Tracy has to find her way in this new world and come to some sort of acceptance with her new home.",68251.0,9.0,11.0,48252,589,James Wilson,"Dec 4, 2002","['F/f', 'F/f+', 'F+/f', 'spanking', 'teen', 'B/D', 'S/M', 'BDSM', 'slavery', 'bondage', 'ScFi', 'reluctant', 'Serious', 'violent']",1.0,0.0,False,https://www.bdsmlibrary.com/stories/story.php?storyid=1359.0
1365.0,The Art Of Escape,A young escape artist gets some unexpected help with his training from his girlfriend. Help he soon begins to regret.,50091.0,9.0,10.0,38492,590,Tyjord,"Dec 7, 2002","['F/m', 'enema', 'WaterSport', 'B/D', 'S/M', 'BDSM', 'bondage', 'reluctant', 'torture', 'nc', 'Heavy']",0.0,1.0,False,https://www.bdsmlibrary.com/stories/story.php?storyid=1365.0
1371.0,Devils Island,This is a long story. The story follows several women from their abduction to their new lives as slaves and beyond.,642665.0,9.0,23.0,279166,592,Balor,"Dec 10, 2002","['M/f', 'F+/f', 'MF/f', 'bestiality', 'enema', 'lactation', 'modification', 'spanking', 'toys', 'WaterSport', 'BDSM', 'slavery', 'torture', 'nc', 'Heavy', 'violent']",1.0,1.0,False,https://www.bdsmlibrary.com/stories/story.php?storyid=1371.0
1378.0,Captured!,"Sarah and three friends are captured by a gang of thugs. Ruthless humiliation and degradation ensues, coupled with Sarah's desperate slide into submission.",154101.0,9.0,14.0,161596,596,soleil,"Dec 11, 2002","['M+/f', 'bestiality', 'exhibition', 'fisting', 'modification', 'toys', 'D/s', 'B/D', 'S/M', 'real', 'romantic', 'humiliation', 'nc', 'Heavy', 'violent']",0.0,1.0,False,https://www.bdsmlibrary.com/stories/story.php?storyid=1378.0
1386.0,Nothing Personal,A mafia runner pays a terrible price when she is caught skimming profits.,18988.0,9.0,7.0,29672,333,Kallie Thomas,"Dec 16, 2002","['M+/f', 'snuff', 'bondage', 'real', 'nc', 'Extreme', 'violent']",0.0,1.0,False,https://www.bdsmlibrary.com/stories/story.php?storyid=1386.0
1396.0,Interest Penalties Apply,A man's failure to repay a loan shark provokes a visit to his home.,22525.0,9.0,5.0,38952,333,Kallie Thomas,"Dec 22, 2002","['M+/f', 'snuff', 'teen', 'real', 'nc', 'Extreme', 'violent']",0.0,1.0,False,https://www.bdsmlibrary.com/stories/story.php?storyid=1396.0
1408.0,Let's Make a Deal,Three teens get in over their heads when they try to sell the drugs they find in a bus station bathroom.,17952.0,9.0,6.0,36097,333,Kallie Thomas,"Dec 30, 2002","['M+/f', 'incest', 'teen', 'real', 'blackmail', 'nc', 'Serious', 'violent']",0.0,1.0,False,https://www.bdsmlibrary.com/stories/story.php?storyid=1408.0
1411.0,Gentle Steps to Complete Domination,It's a slow story about how a guy is dominated by his girlfriend by gentle steps.,102048.0,9.0,18.0,152319,606,Andrew Devine,"Dec 30, 2002","['F/m', 'cbt', 'enema', 'exhibition', 'spanking', 'bondage', 'chastitybelt', 'reluctant', 'humiliation', 'nc', 'Serious']",0.0,1.0,False,https://www.bdsmlibrary.com/stories/story.php?storyid=1411.0
1420.0,Jake's Slaves,A story of slavery and love.,172844.0,9.0,11.0,61446,417,Xodus,"Jan 4, 2003","['M/f', 'F/f', 'MF/f', 'enema', 'exhibition', 'size', 'spanking', 'teen', 'toys', 'voyeurism', 'BDSM', 'slavery', 'bondage', 'slow', 'romantic', 'consensual', 'reluctant', 'humiliation', 'torture', 'Heavy', 'violent']",1.0,0.0,False,https://www.bdsmlibrary.com/stories/story.php?storyid=1420.0
1426.0,The Inventor,A man has invented a device that allows him to control anyone.  What would you do with that kind of power?,26017.0,9.0,7.0,20759,567,BDSM Bill,"Jan 7, 2003","['M/f', 'D/s', 'slavery', 'real', 'romantic', 'mc', 'nc', 'Light']",1.0,1.0,False,https://www.bdsmlibrary.com/stories/story.php?storyid=1426.0
1440.0,Human Resources,"A late-night worker stumbles across the secret activites of the human resources department, and is dragged into it.",49652.0,9.0,6.0,32872,622,Cindy V,"Jan 11, 2003","['F/m', 'F+/m', 'cbt', 'spanking', 'toys', 'transvestite', 'BDSM', 'lingerie', 'bondage', 'job', 'humiliation', 'nc', 'Serious']",0.0,1.0,False,https://www.bdsmlibrary.com/stories/story.php?storyid=1440.0
1536.0,Raping the Escort Girl,A young female college student decides to earn some extra cash by joining an escort agency.  Her troubles begin when she is abducted by one of her regulars...,37936.0,9.0,5.0,31256,556,Dave Haugen,"Mar 12, 2003","['M/f', 'enema', 'spanking', 'toys', 'BDSM', 'slavery', 'bondage', 'job', 'humiliation', 'nc', 'Serious']",1.0,1.0,False,https://www.bdsmlibrary.com/stories/story.php?storyid=1536.0
1322.0,IRC Slut,The personal record of a real life interaction between a masochistic slut and hardcore domme via the internet.,72575.0,9.0,4.0,39579,577,Sherrie W,"Nov 16, 2002","['F/f+', 'exhibition', 'fisting', 'toys', 'BDSM', 'slavery', 'consensual', 'humiliation', 'torture', 'Heavy']",1.0,0.0,False,https://www.bdsmlibrary.com/stories/story.php?storyid=1322.0
1540.0,Turning Michiko,A chance encounter in a bar turns into a night of pain and pleasure at the hands of a stranger.,26787.0,9.0,3.0,19019,610,Sir Kane,"Mar 13, 2003","['M/f', 'exhibition', 'spanking', 'BDSM', 'slavery', 'bondage', 'real', 'romantic', 'consensual', 'torture', 'Heavy']",1.0,0.0,False,https://www.bdsmlibrary.com/stories/story.php?storyid=1540.0
1551.0,The House In The Woods,A romantic ghost story.,27217.0,9.0,3.0,13745,636,T-Luv,"Mar 21, 2003","['M/f', 'interracial', 'spanking', 'teen', 'romantic', 'consensual', 'reluctant', 'nc', 'Light']",0.0,1.0,False,https://www.bdsmlibrary.com/stories/story.php?storyid=1551.0
1557.0,Daddy,She is born to it.,55416.0,9.0,3.0,82914,634,Subher,"Mar 23, 2003","['M/f', 'exhibition', 'spanking', 'teen', 'D/s', 'B/D', 'BDSM', 'slavery', 'bondage', 'real', 'humiliation', 'Heavy']",1.0,0.0,False,https://www.bdsmlibrary.com/stories/story.php?storyid=1557.0
1570.0,The Electric Crab,"In a South American Republic, Colonel Marcos and his assistant, Anna Perez, interrogtate a young woman unfortunate enough to have fallen foul of the Junta.",18938.0,9.0,9.0,111009,677,Cortez,"Apr 3, 2003","['M/f', 'F/f', 'real', 'torture', 'nc', 'Extreme']",0.0,1.0,False,https://www.bdsmlibrary.com/stories/story.php?storyid=1570.0
1594.0,Old Habits Die Hard,"Mike, recently married to Denise, discovers that his new neighbors, Fran & Morty, are the same couple that he and his Mother became involved with two decades ago. Fran is a force of nature and quickly brings Mike back under Fran's control. Mike recalls the wild sexual goings on that ensued  among the four of them once his horny but repressed Mom falls under Fran's spell. Mike also recounts his secret knowledge of his wife's infidelity with an ex-boyfriend. Soon Denise is also under Fran's spell and finds herself involved in major acts of sexual depravity. The story ends when Mike allows his aging and sick Mother to visit with Fran & Morty.",264721.0,9.0,3.0,67751,412,Harry Berg,"Apr 11, 2003","['M+/f+', 'bestiality', 'fisting', 'incest', 'scatology', 'snuff', 'toys', 'WaterSport', 'real', 'mc', 'humiliation', 'blackmail', 'torture', 'nc', 'Extreme', 'violent']",0.0,1.0,False,https://www.bdsmlibrary.com/stories/story.php?storyid=1594.0
1603.0,Jena Commits to Six Months,"A young female agrees to meet her online Master and serve him as his sex slave for a six month period, unsure if she is truly ready to handle such a demanding position.",52435.0,9.0,5.0,35586,556,Dave Haugen,"Apr 16, 2003","['M/f', 'bestiality', 'enema', 'exhibition', 'fisting', 'spanking', 'toys', 'WaterSport', 'BDSM', 'slavery', 'slow', 'romantic', 'consensual', 'reluctant', 'Serious']",1.0,0.0,False,https://www.bdsmlibrary.com/stories/story.php?storyid=1603.0
1606.0,The Village of Agony and Ecstasy,A tale of long time ago when women were taken from their villages to become sex slaves by cruel men that had no regard for them except to satisfy their sexual perversions.,225228.0,9.0,11.0,140829,321,Powerone,"Apr 16, 2003","['M+/f', 'spanking', 'teen', 'slavery', 'bondage', 'historical', 'reluctant', 'humiliation', 'torture', 'nc', 'Serious']",1.0,1.0,False,https://www.bdsmlibrary.com/stories/story.php?storyid=1606.0
1623.0,The Firm,Suzie had tried to keep out of the limelight when her information got the drug dealers at school into trouble. But they worked out who had dropped them in it - and now it's payback time.,29035.0,9.0,9.0,25093,628,Jean-Michel Maserati,"Apr 26, 2003","['M+/f', 'teen', 'college', 'HighSchool', 'nc', 'Serious']",0.0,1.0,False,https://www.bdsmlibrary.com/stories/story.php?storyid=1623.0
1665.0,Partners,"There is a reason people are always warned against going into partnerships.  When things go wrong, they go very wrong. When Robert Miller tried to end his business partnership, he wasn't expecting that his wife and daughter would pay the price for his failed attempt to go it alone.",227158.0,9.0,26.0,231023,369,Semiater,"May 22, 2003","['M+/f+', 'bestiality', 'fisting', 'snuff', 'teen', 'S/M', 'BDSM', 'bondage', 'real', 'humiliation', 'blackmail', 'torture', 'nc', 'Extreme']",0.0,1.0,False,https://www.bdsmlibrary.com/stories/story.php?storyid=1665.0
1667.0,"My Boss, My Slave","A secretary ""persuades"" her boss to submit to being her part-time slave. (Written from the point of view of the secretary, although the author identifies more with the slave!)",101702.0,9.0,6.0,55095,192,Desmios,"May 22, 2003","['F/m', 'F+/m', 'cbt', 'exhibition', 'BDSM', 'slavery', 'bondage', 'job', 'reluctant', 'blackmail', 'Serious']",1.0,0.0,False,https://www.bdsmlibrary.com/stories/story.php?storyid=1667.0
1721.0,"Out of the Frying Pan, into the Fire",A young female executive assistant has boyfriend problems. Her lady boss has a plan to get ride of him.,506964.0,9.0,13.0,108854,136,Musker,"Jun 10, 2003","['F+/f+', 'exhibition', 'modification', 'BDSM', 'job', 'humiliation', 'nc', 'Extreme']",0.0,1.0,False,https://www.bdsmlibrary.com/stories/story.php?storyid=1721.0
1735.0,The Birthday Cake,A young girl is given a birthday spanking and more.,99262.0,9.0,10.0,43260,164,Max Smart,"Jun 20, 2003","['M/f', 'F+/f', 'spanking', 'teen', 'HighSchool', 'humiliation', 'nc', 'Light']",0.0,1.0,False,https://www.bdsmlibrary.com/stories/story.php?storyid=1735.0
1326.0,Mastering Mandy,Man with power of mind control picks up an Asian woman and gives her an unpleasant time.,22372.0,9.0,7.0,44392,550,pamela,"Nov 18, 2002","['M/f', 'D/s', 'S/M', 'mc', 'nc', 'Heavy']",0.0,1.0,False,https://www.bdsmlibrary.com/stories/story.php?storyid=1326.0
1321.0,Jennifer,Jennifer's submissive nature is aroused by her cruel boyfriend. This story will have many parts.,157945.0,9.0,50.0,446320,576,Jennifer Nylon,"Nov 14, 2002","['MF/f', 'exhibition', 'fisting', 'modification', 'spanking', 'toys', 'BDSM', 'slavery', 'bondage', 'real', 'humiliation', 'torture', 'nc', 'Serious']",1.0,1.0,False,https://www.bdsmlibrary.com/stories/story.php?storyid=1321.0
863.0,Cyber,Nice girl falls into the hands of an online predator.,33117.0,9.0,12.0,49911,333,Kallie Thomas,"Apr 6, 2002","['M/f', 'modification', 'snuff', 'teen', 'toys', 'real', 'torture', 'nc', 'Extreme', 'violent']",0.0,1.0,False,https://www.bdsmlibrary.com/stories/story.php?storyid=863.0
1104.0,Ghost Train,"A writer of erotic fiction is taken back in time by a wandering spirit to find out the truth behind her murder. He sees for himself the suffering, pain and degradation she went through before her life was brought to an end. Or was it?",176184.0,9.0,3.0,37831,252,obohobo,"Jul 28, 2002","['M/f', 'F/f', 'spanking', 'WaterSport', 'S/M', 'historical', 'ScFi', 'nc', 'Heavy']",0.0,1.0,False,https://www.bdsmlibrary.com/stories/story.php?storyid=1104.0
875.0,Raiders Dungeon,Story is set in the future. A feudal system is in place. It is a mix of old and new modern miracles. Pain is a way of life for many. As the story continues in several parts an over view of what might take place in a world where even the most cruel tortures can be repaired only to begin again.,242770.0,9.0,11.0,107138,400,DemonLady,"Apr 12, 2002","['M/f', 'modification', 'humiliation', 'torture', 'nc', 'Serious']",0.0,1.0,False,https://www.bdsmlibrary.com/stories/story.php?storyid=875.0
