story_id,story_name,synopsis,length,rating,n_votes,total_readers,author_id,author,added_on,codes,slavery,nc,gay,link
1236.0,Red Revenge,"Quaker virgin is captured by a Delaware Indian warrior in a blood revenge raid over his beloved squaw, who was scalped, murdered, and raped by the virgin's nasty cousin.  Bound and gagged, the virgin responds to the warrior in ways she never dreamed possible. . .",28531.0,9.5,5.0,31000,546,Frances LaGatta,"Oct 11, 2002","['M/f', 'voyeurism', 'BDSM', 'slavery', 'bondage', 'historical', 'romantic', 'Serious', 'violent']",1.0,0.0,False,https://www.bdsmlibrary.com/stories/story.php?storyid=1236.0
1914.0,The Homecoming,"Ellie swore she would never return home again, until her mother's death brings her back. It isn't long before she finds a number of very strange things about her former home town, and her sister seems involved in most of it. What can the secret be, and will Ellie survive investigating it?",77627.0,9.5,7.0,36410,385,sarijak,"Sep 5, 2003","['F/f', 'F+/f', 'incest', 'interracial', 'BDSM', 'slavery', 'mc', 'Heavy']",1.0,0.0,False,https://www.bdsmlibrary.com/stories/story.php?storyid=1914.0
1725.0,Association,"The dueling ""he said/she said"" chronicles of ""Association"" capture and captivate readers with unique first-person perspectives on the tumult and turmoil inherent in all non-consensual relationships of dominance and submission.",471144.0,9.5,16.0,,21,Adrian Hunter,"Jun 13, 2003","['M/f', 'enema', 'spanking', 'toys', 'BDSM', 'feet', 'hair', 'latex', 'slavery', 'lingerie', 'bondage', 'chastitybelt', 'torture', 'nc', 'Heavy']",1.0,1.0,False,https://www.bdsmlibrary.com/stories/story.php?storyid=1725.0
1707.0,Stephanie's New Life,"While quite lengthy, these letters are quite real. They tell beautifully the budding relationship between myself, several women and their transformation into Dominants.  And, of course, the complete transformation of the key subject, Angel (or Stephanie) into a full time slave and servant.  Even as long as it is it is a beautiful story, made more beautiful because it is a real stroy of the road to discovery that is all too rare in this world.",946117.0,9.5,21.0,127375,724,Sasha K,"Jun 3, 2003","['F+/f', 'exhibition', 'fisting', 'incest', 'modification', 'scatology', 'spanking', 'teen', 'toys', 'WaterSport', 'D/s', 'S/M', 'slavery', 'job', 'real', 'romantic', 'consensual', 'humiliation', 'Serious']",1.0,0.0,False,https://www.bdsmlibrary.com/stories/story.php?storyid=1707.0
1803.0,Shipment,"A story of the evolution of mass production in the very distant future, with a twist that might surprise you unless you were paying attention. Almost no sex, but some interesting concepts explored.",31878.0,9.5,10.0,29337,639,AlwaysCocked,"Jul 20, 2003","['M/f', 'enema', 'lactation', 'modification', 'size', 'transgender', 'D/s', 'latex', 'slavery', 'bondage', 'ScFi', 'nc', 'Heavy']",1.0,1.0,False,https://www.bdsmlibrary.com/stories/story.php?storyid=1803.0
1817.0,Sneaking Out,"When two young girls sneak out to go to the bar one night, they happen to call the wrong Taxi service.",72166.0,9.5,10.0,67060,369,Semiater,"Jul 31, 2003","['M+/f+', 'teen', 'BDSM', 'slavery', 'real', 'nc', 'Serious']",1.0,1.0,False,https://www.bdsmlibrary.com/stories/story.php?storyid=1817.0
1576.0,Mock Rape II:  The Search for Claire,"The sequel to ""Mock Rape, Inc."" in which Amy becomes a pony girl, Malcolm abducts the wrong woman, Cindy wants to know if Amy is for real, Bev bangs her head against the wall, Manfred is even more despicable than last time, Suzanne would like to know how you like her new shoes, Sebastian searches for new trainees, Grace gets even, and Claire really, really wishes she was home to take your call.",222969.0,9.5,8.0,29036,148,Harold,"Apr 3, 2003","['M/f', 'M/f+', 'spanking', 'BDSM', 'feet', 'slavery', 'consensual', 'torture', 'nc', 'Heavy', 'violent']",1.0,1.0,False,https://www.bdsmlibrary.com/stories/story.php?storyid=1576.0
1869.0,Sarah's Punishment,Cyrus Marks shares a tale detailing the unfortunate experience of young Sarah McCluskey when she falls into his clutches.,111282.0,9.5,7.0,86162,164,Max Smart,"Aug 16, 2003","['M/f', 'spanking', 'teen', 'HighSchool', 'humiliation', 'nc', 'Heavy']",0.0,1.0,False,https://www.bdsmlibrary.com/stories/story.php?storyid=1869.0
1538.0,Slavery 2020,"2020: Slavery Conscription, young men serving two years as work slaves, has been operating successfuly in Great Britain since 1997. It's made that country an economic superpower, but at what price? In 21st Century Britain, we hear the story from both sides: the slaves and the women exempted from this horrific experience yet affected all the same.",90849.0,9.5,6.0,67267,666,Factory boy,"Mar 12, 2003","['F+/m', 'S/M', 'BDSM', 'slavery', 'real', 'reluctant', 'Heavy', 'violent']",1.0,0.0,False,https://www.bdsmlibrary.com/stories/story.php?storyid=1538.0
1532.0,The Training,Turning my daughter into a willing sex slave.,41272.0,9.5,11.0,116464,659,Ninja Turtle,"Mar 12, 2003","['M+/f+', 'exhibition', 'fisting', 'incest', 'teen', 'voyeurism', 'D/s', 'BDSM', 'slavery', 'reluctant', 'humiliation', 'Serious']",1.0,0.0,False,https://www.bdsmlibrary.com/stories/story.php?storyid=1532.0
1501.0,2nd Chance - The Organization Series 3,"Continuation of The Organization Series, the experiences of a slave tested by her new Master.",326536.0,9.5,13.0,115091,430,slave ruthie,"Feb 25, 2003","['M/f', 'fisting', 'snuff', 'BDSM', 'slavery', 'chastitybelt', 'real', 'torture', 'Heavy']",1.0,0.0,False,https://www.bdsmlibrary.com/stories/story.php?storyid=1501.0
1500.0,V Is For Victim - The Organization Series 2,"This is part of the Organization Series - it follows   ""The House of Ali"" and precedes ""The Performers"".",47089.0,9.5,5.0,55008,430,slave ruthie,"Feb 25, 2003","['M+/f', 'teen', 'BDSM', 'slavery', 'chastitybelt', 'real', 'torture', 'nc', 'Heavy']",1.0,1.0,False,https://www.bdsmlibrary.com/stories/story.php?storyid=1500.0
1484.0,The Degradation of Tricia,An 18-year-old schoolgirl is blackmailed into becoming the sex plaything of an evil brother and sister.,326005.0,9.5,13.0,186081,645,Lia Anderssen,"Feb 11, 2003","['f-self', 'MF/f', 'exhibition', 'D/s', 'nc', 'Serious']",0.0,1.0,False,https://www.bdsmlibrary.com/stories/story.php?storyid=1484.0
1478.0,Gambling Debt,A man wins two sisters playing pool.,92311.0,9.5,15.0,57442,567,BDSM Bill,"Feb 11, 2003","['M/f+', 'spanking', 'D/s', 'B/D', 'slavery', 'bondage', 'real', 'reluctant', 'Serious']",1.0,0.0,False,https://www.bdsmlibrary.com/stories/story.php?storyid=1478.0
1454.0,The Bra,Madame Cong is at it again and female slavery is her thing.  This time she is out to get a nosey FBI agent.,56091.0,9.5,11.0,59098,275,Jackpot,"Jan 21, 2003","['F/f', 'modification', 'D/s', 'BDSM', 'slavery', 'lingerie', 'real', 'mc', 'humiliation', 'nc', 'Serious', 'violent']",1.0,1.0,False,https://www.bdsmlibrary.com/stories/story.php?storyid=1454.0
1895.0,Julie,"Julie is an average teenage girl in the orphanage, with no idea of her unusual past. When a twisted criminal begins kidnapping her friends, she begins to experience a world she never knew existed and learns of the strange abilities she possesses.",645011.0,9.5,20.0,196586,749,Lord Douche,"Sep 1, 2003","['M/f+', 'F/f+', 'MF/f', 'enema', 'modification', 'teen', 'toys', 'D/s', 'latex', 'slavery', 'bondage', 'chastitybelt', 'ScFi', 'humiliation', 'nc', 'Serious']",1.0,1.0,False,https://www.bdsmlibrary.com/stories/story.php?storyid=1895.0
1418.0,The Wonderful Brassiere,Sarah's enforced wearing of a painful garment provides an evening of entertainment for her father and his friends.,16716.0,9.5,19.0,75160,550,pamela,"Jan 4, 2003","['M+/f', 'BDSM', 'nc', 'Serious']",0.0,1.0,False,https://www.bdsmlibrary.com/stories/story.php?storyid=1418.0
1238.0,Discipline,Journey of self discovery for young submissive and her Master.,38259.0,9.5,7.0,62693,548,Nikki,"Oct 11, 2002","['M/f', 'M+/f', 'spanking', 'BDSM', 'bondage', 'slow', 'reluctant', 'humiliation', 'nc', 'Serious']",0.0,1.0,False,https://www.bdsmlibrary.com/stories/story.php?storyid=1238.0
1928.0,Puppet-Girl,A young supervisor's lesbian employees take matters firmly in hand.,32741.0,9.5,8.0,39332,403,Couture,"Sep 10, 2003","['F+/f', 'D/s', 'slavery', 'job', 'reluctant', 'humiliation', 'blackmail', 'Serious']",1.0,0.0,False,https://www.bdsmlibrary.com/stories/story.php?storyid=1928.0
1389.0,Enslaved,"Jana wanted to experience complete submission, and contracted for a few months as Kurt's slave.  Kurt provides fantasy fulfillment, but he takes it to an extreme.  Once Jana gives herself over to him, there is no turning back for her, as her enslavement becomes more real than fantasy, and becomes a nightmare not a dream.",111260.0,9.5,14.0,126999,594,Reine Woods,"Dec 19, 2002","['M+/f', 'enema', 'exhibition', 'toys', 'BDSM', 'slavery', 'bondage', 'real', 'consensual', 'reluctant', 'humiliation', 'torture', 'nc', 'Heavy', 'violent']",1.0,1.0,False,https://www.bdsmlibrary.com/stories/story.php?storyid=1389.0
5.0,White victim,White girl were captured by two black women and trained to be a painslut. The story ends up with a public catfighting event.,130401.0,9.5,8.0,93908,5,Allene Blake,"Jun 29, 2000","['M/f', 'F/f', 'F+/f', 'B/D', 'nc', 'Serious']",0.0,1.0,False,https://www.bdsmlibrary.com/stories/story.php?storyid=5.0
1959.0,Lash of the Desperados,"Teresa Martinez is a ravishing young girl who pours drinks in a backwater cantina in Sonora Mexico. She dreams of having enough money to take the long stagecoach ride to San Francisco where, she is sure, her sparkling eyes, her luscious body, and her sensuous dancing will win her a rich banker or railroader or the like.  Then one night an American cowpoke stops by the cantina and has a good run of luck in a poker game.  Teresa, mesmerized by the pile of money in front of the gringo, decides to dance for him. And more. But greed is a sin. And some sins are punished here on earth.",316052.0,9.5,4.0,114390,578,Big Jake,"Sep 24, 2003","['M+/f', 'teen', 'voyeurism', 'BDSM', 'historical', 'torture', 'nc', 'Heavy']",0.0,1.0,False,https://www.bdsmlibrary.com/stories/story.php?storyid=1959.0
1372.0,The Trainer,"Collecting for her brother's paper route, Adrienne knocks on the wrong door, walking into the hands of a man whose job is procuring slaves.",22662.0,9.5,8.0,59881,333,Kallie Thomas,"Dec 10, 2002","['M/f', 'M+/f', 'modification', 'teen', 'toys', 'BDSM', 'slavery', 'bondage', 'real', 'humiliation', 'torture', 'nc', 'Heavy', 'violent']",1.0,1.0,False,https://www.bdsmlibrary.com/stories/story.php?storyid=1372.0
1370.0,The Searcher,"Beautiful blonde rosemary allows herself to be kidnapped into white slavery to search for her younger sister, enduring much humiliation, discipline, betrayal and torture in her quest.",471985.0,9.5,4.0,72309,588,Martin Hughes,"Dec 10, 2002","['M/f+', 'F/f', 'BDSM', 'slavery', 'bondage', 'real', 'humiliation', 'torture', 'nc', 'Serious']",1.0,1.0,False,https://www.bdsmlibrary.com/stories/story.php?storyid=1370.0
1976.0,Miss Yumi Inoue,"Eighteen years old, beautiful, lonely, shy, quiet. A perfect target for the attentions of her sexy Professor...",34085.0,9.5,15.0,41664,385,sarijak,"Oct 2, 2003","['F/f', 'teen', 'slavery', 'chastitybelt', 'college', 'blackmail', 'Serious']",1.0,0.0,False,https://www.bdsmlibrary.com/stories/story.php?storyid=1976.0
1339.0,Forty Four Hours,A woman is forced into a deeper exploration of her desires to experience slavery and bdsm by her domme and her domme's friends.,261269.0,9.5,18.0,154777,582,Kay,"Nov 24, 2002","['F+/f', 'exhibition', 'D/s', 'BDSM', 'feet', 'slavery', 'bondage', 'real', 'reluctant', 'mc', 'humiliation', 'Serious']",1.0,0.0,False,https://www.bdsmlibrary.com/stories/story.php?storyid=1339.0
1336.0,Cindy and Company,"Cindy is the queen of her high school, but her home life is a different matter. When she turns down a date with a nerdy fellow student, she has no idea what she's starting.",407556.0,9.5,20.0,186995,550,pamela,"Nov 20, 2002","['M/f', 'M/f+', 'M+/f', 'M+/f+', 'bestiality', 'incest', 'interracial', 'teen', 'BDSM', 'slavery', 'bondage', 'HighSchool', 'humiliation', 'blackmail', 'torture', 'nc', 'Heavy', 'violent']",1.0,1.0,False,https://www.bdsmlibrary.com/stories/story.php?storyid=1336.0
2018.0,Lisa Meets her Master,"A young sub girl, who had a rough life, is found by a Master who was seeking the perfect slave and her training begins.",435654.0,9.5,16.0,191883,849,GrkDom,"Oct 21, 2003","['M+/f+', 'F+/f', 'exhibition', 'modification', 'WaterSport', 'D/s', 'BDSM', 'slavery', 'bondage', 'real', 'consensual', 'torture', 'Heavy']",1.0,0.0,False,https://www.bdsmlibrary.com/stories/story.php?storyid=2018.0
2270.0,Debbie's Dilemma,Debbie really should not have cheated on Eddie!,17603.0,9.5,12.0,32726,604,Anne Gray,"Feb 16, 2004","['M/f', 'D/s', 'B/D', 'nc', 'Serious']",0.0,1.0,False,https://www.bdsmlibrary.com/stories/story.php?storyid=2270.0
1276.0,Bubba Seizes the Day,An arrogant female university student/gymnast is abducted by a black janitor and forced into a number of humiliating situations.,188217.0,9.5,4.0,53722,556,Dave Haugen,"Oct 30, 2002","['M/f', 'interracial', 'spanking', 'toys', 'WaterSport', 'BDSM', 'slavery', 'bondage', 'college', 'humiliation', 'nc', 'Serious']",1.0,1.0,False,https://www.bdsmlibrary.com/stories/story.php?storyid=1276.0
1266.0,Vestal Whore: Communion of Degradation,"The girl has always dreamed of becoming a lawyer and as such has previously been a quiet but excellent student. After her father is off to a remote & dangerous part of the country, the virgin girl gets raped, and soon finds out that the more abuse & humiliation that is heaped upon her, the hotter & hornier she gets, and soon becomes a big pain slut taking on all comers  allowing her tormentors to do the most perverse and painful things to her, not to mention all the gang bangs that she goes through.",754850.0,9.5,7.0,250080,554,Toryu,"Oct 26, 2002","['M+/f', 'bestiality', 'exhibition', 'fisting', 'incest', 'interracial', 'BDSM', 'reluctant', 'nc', 'Serious']",0.0,1.0,False,https://www.bdsmlibrary.com/stories/story.php?storyid=1266.0
1253.0,Even Ponygirls Sometimes Get The Blues,"More adventures of Jessica and Kate as they attempt to escape their naked and chained imprisonment on Rabbit Island. They are smart girls but somehow their captors always seem to get the upper hand. This time they determined to outwit their so-called Masters. Like the previous story, Rabbit Island, this is a leisurely-paced tale of female bondage, punishment, fulfillment and wicked games, non-consensual but generally light and sexy in tone. The story is being posted as I write it, so any reviews and feedback (good or bad) are welcomed.",1304802.0,9.5,36.0,277791,468,Aurelius,"Oct 19, 2002","['M/f', 'M/f+', 'M+/f+', 'modification', 'spanking', 'S/M', 'slavery', 'bondage', 'chastitybelt', 'humiliation', 'torture', 'nc', 'Serious']",1.0,1.0,False,https://www.bdsmlibrary.com/stories/story.php?storyid=1253.0
829.0,Fantasia: Collection Of Viddler's Stories,"The stories by V.P. Viddler. As a master of the story-by- dialogue, the author presents readers with a series of women who enjoy the terrible pain inflicted by men. Stories are very well written, technically speaking.",1496994.0,9.5,14.0,,384,V.P. Viddler,"Mar 22, 2002","['M/f', 'M/f+', 'incest', 'teen', 'D/s', 'S/M', 'bondage', 'humiliation', 'torture', 'nc', 'Serious']",0.0,1.0,False,https://www.bdsmlibrary.com/stories/story.php?storyid=829.0
1772.0,Lost for Words,"Amy is a writer, crafting stories of young and beautiful women, helplessly enslaved and tortured. When she comes down with writers' block, her biggest fan offers advice, and a very special way to give Amy some inspiration, although the beautiful young writer may not appreciate it fully...",48743.0,9.5,12.0,30354,385,sarijak,"Jul 4, 2003","['F/f', 'F+/f', 'interracial', 'D/s', 'B/D', 'slavery', 'reluctant', 'Serious']",1.0,0.0,False,https://www.bdsmlibrary.com/stories/story.php?storyid=1772.0
2588.0,Hanging For The Weekend,"When Kirsten decides to start a quiet weekend alone by hanging by her wrists in the garage, things quickly go wrong - and get much worse when company arrives.",52337.0,9.5,21.0,71758,906,Kirsten Smart,"Jun 6, 2004","['M/f', 'f-self', 'S/M', 'bondage', 'consensual', 'torture', 'nc']",0.0,1.0,False,https://www.bdsmlibrary.com/stories/story.php?storyid=2588.0
814.0,Parker 19: Blackout,A power outtage on a subway ride proves to be a life changing experience for a young lawyer.,29900.0,9.5,4.0,28890,251,Parker,"Mar 14, 2002","['M+/f', 'nc', 'Serious']",0.0,1.0,False,https://www.bdsmlibrary.com/stories/story.php?storyid=814.0
731.0,All Good Fun,"Josh, a serial rapist, details his exploits while planning his next attack.",13284.0,9.5,7.0,51174,333,Kallie Thomas,"Feb 5, 2002","['M/f', 'lactation', 'pregnant', 'teen', 'bondage', 'real', 'humiliation', 'torture', 'nc', 'Hardcore', 'violent']",0.0,1.0,False,https://www.bdsmlibrary.com/stories/story.php?storyid=731.0
720.0,College Submission,"Jackie had been eagerly awaiting this weekend for awhile now.  With the college community heading home (or to Florida) for Spring Break, she decided to use this new-found privacy to engage in a thorough self-bondage session... that is, until her best-friend/roommate catches her...",111742.0,9.5,24.0,97706,345,Da'Rookie22,"Feb 1, 2002","['F/f', 'spanking', 'teen', 'toys', 'D/s', 'BDSM', 'bondage', 'college', 'reluctant', 'humiliation', 'blackmail', 'nc', 'Serious']",0.0,1.0,False,https://www.bdsmlibrary.com/stories/story.php?storyid=720.0
2420.0,"Avatar, Book 1:  Establishment",This story is about a man who becomes an Avatar for a sex goddess.,1415758.0,9.5,29.0,163047,1000,Dark Pen,"Apr 5, 2004","['M/f+', 'F+/f+', 'Young', 'teen', 'WaterSport', 'BDSM', 'slavery', 'ScFi', 'consensual', 'humiliation', 'Heavy']",1.0,0.0,False,https://www.bdsmlibrary.com/stories/story.php?storyid=2420.0
702.0,Training Grounds,It's about a salve going to traing academy.,32185.0,9.5,3.0,36565,334,Mystery man,"Jan 25, 2002","['M/f', 'M+/f+', 'F/f', 'F+/m+', 'exhibition', 'spanking', 'toys', 'B/D', 'S/M', 'BDSM', 'slavery', 'bondage', 'humiliation', 'torture', 'Serious']",1.0,0.0,False,https://www.bdsmlibrary.com/stories/story.php?storyid=702.0
682.0,Sunder,"This is a very long, dark tale that bounces around between many characters. There are 3 heirs to a major privately held corporation, for which their father split into 3 divisions, one for each child, but allowing for 1 of them to end up in control of the entire company. All three are very dominant and have many sexual perversions. You don't want to get on the bad side, as death would be preferable to what they will do to you. They act as if they are above the law as well as above anyone questioning their actions. All three are very dominant both in their public & private lives. All engage in sex with their employees as well as those unfortunate to be captured by this hauty trio. Very erotic and sadistic.",533269.0,9.5,12.0,117697,30,Unknown,"Jan 16, 2002","['M/f', 'F/f', 'F+/f', 'F+/f+', 'F/m', 'f-self', 'MF/f', 'exhibition', 'fisting', 'modification', 'pregnant', 'scatology', 'size', 'snuff', 'spanking', 'teen', 'voyeurism', 'WaterSport', 'BDSM', 'slavery', 'bondage', 'gothic', 'job', 'real', 'reluctant', 'humiliation', 'blackmail', 'torture', 'nc', 'Heavy', 'violent']",1.0,1.0,False,https://www.bdsmlibrary.com/stories/story.php?storyid=682.0
2677.0,Macros Story,"This is a sequel, or maybe a prequel to my story, Jills Day Out.",25130.0,9.5,11.0,50373,1092,Jill Bird,"Jul 2, 2004","['M/f', 'bestiality', 'B/D', 'BDSM', 'slavery', 'bondage', 'real', 'humiliation', 'blackmail', 'torture', 'nc', 'Extreme', 'violent']",1.0,1.0,False,https://www.bdsmlibrary.com/stories/story.php?storyid=2677.0
2665.0,Farm Call,"a young woman enjoys her job as a sales rep for an agricultural company, until she visits a very strange farm.",12232.0,9.5,23.0,87944,1092,Jill Bird,"Jun 29, 2004","['bestiality', 'S/M', 'job', 'nc', 'Extreme']",0.0,1.0,False,https://www.bdsmlibrary.com/stories/story.php?storyid=2665.0
367.0,Chateau Noir,His uncle was a sponsor to a private discipline school and he was sent to this school to meet the head mistress. This was definately an unexpected and exciting experience for him.,253107.0,9.5,8.0,72785,196,Frank Watson,"Jun 4, 2001","['M/f', 'F/f+', 'BDSM', 'slavery', 'Serious']",1.0,0.0,False,https://www.bdsmlibrary.com/stories/story.php?storyid=367.0
156.0,The Princess's Court,"A tale of punishments set in a fantasy world. A wicked Princess, a victimized Princess, and an honorable soldier.",156195.0,9.5,7.0,42457,102,ArcSyn,"Dec 6, 2000","['F/f', 'F/m', 'exhibition', 'spanking', 'D/s', 'B/D', 'ScFi', 'romantic', 'humiliation', 'nc', 'Serious']",0.0,1.0,False,https://www.bdsmlibrary.com/stories/story.php?storyid=156.0
467.0,Dawn's Story,Aliens (who look more-or-less human) come to Earth and 'de-evolve' selected people to their natural state to serve as slaves.  Story follows the adventures of a particular slave and her loving mistress.,170998.0,9.5,5.0,38940,30,Unknown,"Aug 22, 2001","['M/f', 'M+/f', 'F/f', 'F+/f', 'exhibition', 'modification', 'D/s', 'BDSM', 'slavery', 'ScFi', 'consensual', 'nc', 'Serious']",1.0,1.0,False,https://www.bdsmlibrary.com/stories/story.php?storyid=467.0
297.0,Coming of Age,The girls in the Martin family undergo a very special ritual among the town members when they reach womanhood...,30223.0,9.5,12.0,64780,26,Terri Madison,"May 7, 2001","['M+/f', 'M+/f+', 'F/f', 'fisting', 'incest', 'BDSM', 'slavery', 'bondage', 'humiliation', 'torture', 'nc', 'Heavy']",1.0,1.0,False,https://www.bdsmlibrary.com/stories/story.php?storyid=297.0
2589.0,The Long Road to Slavery,"Bored with her life, Jenny decides to liven things up a bit.  A strange one-night stand and a pilfered video open her mind to an entirely new existence as a slave.",114969.0,9.5,10.0,64849,1074,Simone Locke,"Jun 6, 2004","['M+/f+', 'enema', 'lactation', 'spanking', 'BDSM', 'slavery', 'bondage', 'real', 'humiliation', 'nc', 'Heavy']",1.0,1.0,False,https://www.bdsmlibrary.com/stories/story.php?storyid=2589.0
2609.0,Rita's Department Store Adventure,"Rita Donovan, an arrogant 24-year-old sophisticate, is victimized by a thief, runs afoul of a sales girl and others, and is reduced to the status of a spanked and diapered child in a school uniform by the slightly younger woman AND a host of intimidating memories.  Will she sink or swim?",95660.0,9.5,6.0,51945,1084,Alec Leamus,"Jun 12, 2004","['MF/f', 'spanking', 'voyeurism', 'D/s', 'humiliation', 'nc']",0.0,1.0,False,https://www.bdsmlibrary.com/stories/story.php?storyid=2609.0
2455.0,FutureDomme,"A femdom vacation gets caught up in law changes and contractual fine print.  In a much changed society, even more is in store for our hero(in).",499352.0,9.5,4.0,60950,1016,counterparts199,"Apr 18, 2004","['F/m', 'F/m+', 'modification', 'transgender', 'D/s', 'S/M', 'slavery', 'chastitybelt', 'consensual', 'reluctant', 'humiliation', 'torture', 'Heavy']",1.0,0.0,False,https://www.bdsmlibrary.com/stories/story.php?storyid=2455.0
269.0,"Mock Rape, Inc.","Malcolm finds the perfect niche business, only to discover he has a competitor.",80180.0,9.5,12.0,77524,148,Harold,"Apr 16, 2001","['M+/f+', 'spanking', 'BDSM', 'job', 'consensual', 'reluctant', 'humiliation', 'blackmail', 'nc', 'Serious']",0.0,1.0,False,https://www.bdsmlibrary.com/stories/story.php?storyid=269.0
283.0,Letter From a Strict Mom,A schoolgirl with bad marks receives very strict extra tuition on a cruel.,104768.0,9.5,10.0,86291,164,Max Smart,"Apr 24, 2001","['MF/f', 'spanking', 'teen', 'S/M', 'HighSchool', 'real', 'nc', 'Serious']",0.0,1.0,False,https://www.bdsmlibrary.com/stories/story.php?storyid=283.0
575.0,Children Of The Night,A romantic bdsm story about how a normal girl was trained to be her master's slavegirl.,603690.0,9.5,4.0,67913,291,Veronica Leigh Marquette,"Nov 15, 2001","['M/f', 'M/f+', 'F/m+', 'spanking', 'toys', 'BDSM', 'slavery', 'romantic', 'reluctant', 'humiliation', 'Light']",1.0,0.0,False,https://www.bdsmlibrary.com/stories/story.php?storyid=575.0
552.0,Daddy's Little Girl,"A young, vulnerable girl, is caught masturbating by her Daddy, and he takes it upon himself to teach her what little girls who masturbate deserve.",361.0,9.5,8.0,81257,281,Humiliator,"Oct 31, 2001","['M/f', 'f-self', 'incest', 'Young', 'teen', 'D/s', 'slavery', 'reluctant', 'humiliation', 'nc', 'Hardcore']",1.0,1.0,False,https://www.bdsmlibrary.com/stories/story.php?storyid=552.0
530.0,Fate,"A psychological story dealing with revenge, love, lesbian sex and S&M. The plot line is such that there are really three stories in one. This is a first for me, so I hope I can pull it off without boring the readed to tears or making it sound to hokey. It is also a colaborated story that seems to be working out pretty well, all be it that I am as slow as molasis in writing it.",172690.0,9.5,3.0,45678,269,Mistress Jytte and Musker,"Oct 12, 2001","['F+/f+', 'interracial', 'modification', 'BDSM', 'college', 'humiliation', 'blackmail', 'nc', 'Serious']",0.0,1.0,False,https://www.bdsmlibrary.com/stories/story.php?storyid=530.0
522.0,Arranged Marriages,Hoping to avoid bankruptcy Elizabeth's parents force her to spend a week with Aaron at a remote cottage. They instruct her to seduce him into marrying her but things don't go according to plan.,67177.0,9.5,4.0,40951,252,obohobo,"Oct 10, 2001","['M+/f+', 'spanking', 'BDSM', 'real', 'nc', 'Serious']",0.0,1.0,False,https://www.bdsmlibrary.com/stories/story.php?storyid=522.0
